{
  "schema_version": "1.0.0",
  "name": "app_data_dir",
  "platform": "windows",
  "adapter_id": "desktop_windows",
  "available": true,
  "permission_required": false,
  "permission": "not_applicable",
  "provided_uri": "platform-app-data://chriptmas-replay",
  "error": null,
  "checked_at": "2026-06-29T11:00:00+08:00"
}
